<slc-execution-request
	xmlns="http://argeo.org/projects/slc/schemas"
	xmlns:xsi="http://www.w3.org/2001/XMLSchema-instance"
	xsi:schemaLocation="http://argeo.org/projects/slc/schemas ../src/main/webapp/WEB-INF/slc.xsd">
	<slc-execution uuid="18b64f3f-6697-406a-997a-94356020c9f2">
		<steps>
			<slc-execution-step>
				<log-lines>
					<log-line>A log message</log-line>
					<log-line>and another line</log-line>
				</log-lines>
				<type>LOG</type>
				<begin>2008-04-17T18:21:00.000+02:00</begin>
			</slc-execution-step>
			<slc-execution-step>
				<log-lines>
					<log-line>A nothe rlog message</log-line>
				</log-lines>
				<type>LOG</type>
				<begin>2008-04-17T18:25:00.000+02:00</begin>
			</slc-execution-step>
		</steps>
		<status>STARTED</status>
		<type>slcAnt</type>
		<host>localhost</host>
		<path>/test</path>
	</slc-execution>
</slc-execution-request>